{
  "$schema": "http://json-schema.org/draft-07/schema#",
  "$id": "https://beyondforms.citylab-berlin.org/demo/persona.schema.json",
  "title": "BeyondForms demo persona",
  "description": "A reviewable fixture describing one demo account: the `users` row, its application, its documents, and the research context that the database cannot hold. Materialised by src/services/demo_seed_service.py.",
  "type": "object",
  "required": [
    "slug",
    "phone_number",
    "title",
    "source",
    "scenario",
    "profile",
    "applications",
    "documents"
  ],
  "additionalProperties": false,
  "properties": {
    "$schema": {
      "type": "string"
    },
    "slug": {
      "type": "string",
      "pattern": "^[a-z][a-z0-9_]*$",
      "description": "Stable identifier. Must match the filename stem."
    },
    "phone_number": {
      "type": "string",
      "description": "Must be a Bundesnetzagentur drama number so is_test_account() accepts it. See libs/auth/src/beyondforms/auth/test_accounts.py.",
      "pattern": "^(\\+49)?(3023125|6990009|4066969|2214710|8999998)[0-9]+$"
    },
    "title": {
      "type": "string"
    },
    "source": {
      "type": "string",
      "description": "Repo-relative path to the research document this persona is derived from.",
      "pattern": "^demo/research/.+\\.md$"
    },
    "portrait": {
      "type": "string",
      "description": "Path relative to demo/personas/. Synthetic likeness for documentation only; never stored in the database or used as a document blob."
    },
    "scenario": {
      "type": "string",
      "description": "What this persona is for — which part of the process it exercises."
    },
    "profile": {
      "type": "object",
      "description": "Keys must be `users` column names, or `associated_persons` (a relationship, whose entries follow AssociatedPersonSchema). Values must satisfy the DB enums. Validated in tests/test_demo_personas.py.",
      "minProperties": 1
    },
    "applications": {
      "type": "array",
      "description": "One entry per form_type this persona needs scoped `form_data` for. Each is get-or-created by form_type. Documents attach to the first entry's row (user_documents has a single fk_application_id).",
      "minItems": 1,
      "items": {
        "type": "object",
        "required": [
          "form_type",
          "status"
        ],
        "additionalProperties": false,
        "properties": {
          "form_type": {
            "type": "string"
          },
          "status": {
            "enum": [
              "in_progress",
              "completed",
              "submitted"
            ]
          },
          "form_data": {
            "type": "object"
          }
        }
      }
    },
    "documents": {
      "type": "array",
      "items": {
        "type": "object",
        "required": [
          "document_type",
          "status",
          "asset",
          "raw_data"
        ],
        "additionalProperties": false,
        "properties": {
          "document_type": {
            "description": "Frontend slot id, as written by src/worker.py. Not a document-intelligence registry name.",
            "enum": [
              "id_card",
              "registration",
              "health_insurance",
              "pension_notice",
              "stmt3",
              "income",
              "assets",
              "bank",
              "rent",
              "utility_bill",
              "heating",
              "housing",
              "household",
              "cooperation_agreement",
              "OTHER"
            ]
          },
          "status": {
            "enum": [
              "processing",
              "ready_for_review",
              "completed",
              "failed",
              "verified"
            ]
          },
          "display_name": {
            "type": "string",
            "description": "Human filename. German keywords in it are load-bearing for the frontend's slot matching."
          },
          "asset": {
            "description": "Either a filename resolved against DEMO_ASSETS_PATH, or an instruction to generate a watermarked demo PDF from raw_data.",
            "oneOf": [
              {
                "type": "string"
              },
              {
                "type": "object",
                "required": [
                  "generate",
                  "title"
                ],
                "additionalProperties": false,
                "properties": {
                  "generate": {
                    "const": true
                  },
                  "title": {
                    "type": "string"
                  },
                  "subtitle": {
                    "type": "string"
                  }
                }
              }
            ]
          },
          "raw_data": {
            "type": "object",
            "description": "Validated against the document-intelligence schema for this slot's registry type (extra='forbid'). Computed fields such as health_insurance_proof.is_private must NOT appear."
          },
          "user_error_code": {
            "description": "Only meaningful for failed / ready_for_review documents. These four are the codes with a review.warnings message in the wallet-frontend profile locales.",
            "enum": [
              "PAGINATION_MISSING_PAGES",
              "LEGIBILITY_ISSUES",
              "DATA_CONFLICTS",
              "OLD_STATEMENT_WARNING"
            ]
          },
          "internal_error_log": {
            "type": "string"
          }
        }
      }
    }
  }
}
