{
  "$schema": "../persona.schema.json",
  "slug": "sabine",
  "phone_number": "+493023125101",
  "title": "Sabine — Alleinstehende deutsche Frau, volle Erwerbsminderungsrente",
  "source": "demo/research/01_sabine.md",
  "portrait": "portraits/Sabine.png",
  "scenario": "Mid-flow, deliberately incomplete. Her Rentenbescheid is missing entirely and her Kontoauszug is flagged as an old statement — the exact 'unclear or hard-to-obtain proof' situation her User Story 6 describes. Use this one for to-do handling, encouragement copy, and the cognitive-load questions.",

  "profile": {
    "first_name": "Sabine",
    "last_name": "Reinhardt",
    "email": "sabine.reinhardt@example.org",
    "date_of_birth": "1968-04-22",
    "place_of_birth": "Potsdam",
    "legal_gender": "Female",
    "marital_status": "Single",
    "married_since": null,
    "is_german_citizen": true,
    "is_resident_in_germany": true,
    "nationality": "DE",
    "second_nationality": null,
    "has_guardian": false,
    "has_custodian": false,
    "displaced_status": null,
    "residence_status": null,
    "license_plate": "B-SR 224",
    "vehicle_make": "Toyota Yaris",
    "vehicle_year": "2011",

    "street": "Invalidenstraße",
    "house_number": "84",
    "zip_code": "10115",
    "city": "Berlin",
    "state": "Berlin",
    "district": "Mitte",

    "persons_in_household_count": 1,

    "social_security_type": "Pension Insurance",
    "health_insurance_provider": "BARMER",
    "health_insurance_status": "Compulsory Insurance",
    "pension_insurance_provider": "Deutsche Rentenversicherung Bund",
    "pension_insurance_no": "22220468R071",

    "is_currently_employed": false,
    "can_work_at_least_3h_daily": false,
    "ability_to_work": "Permanently disabled",
    "has_permanent_reduction_in_earning_capacity": true,
    "reduced_work_capacity_start_date": "2019-10-01",
    "reduced_work_capacity_end_date": null,
    "reduced_work_capacity_reason": "Unbefristete volle Erwerbsminderung, festgestellt durch den Rentenversicherungsträger",
    "has_inpatient_facility_accommodation": false,
    "inpatient_facility_move_in_date": null,
    "inpatient_facility_last_residence": null,

    "accomodation_type": "Rental Apartment",
    "tenancy_status": "Main Tenant",
    "rent_total": 780.00,
    "heating_costs": 105.00,
    "hot_water_costs": 20.00,
    "cable_tv_costs": 0.00,
    "number_of_rooms": 2,
    "living_area": 52.00,
    "sublet_room_count": null,
    "sublet_rent_income": null,
    "rent_paid_until": "2026-07-31",
    "landlord_name": "Wohnungsbaugesellschaft Mitte mbH",
    "heating_type": "Sammelheizung",
    "free_housing_right_holder": null,

    "monthly_income": 245.00,
    "income_entries": [
      { "income_type": "Pension", "monthly_amount": 245.0 }
    ],
    "has_assets": true,
    "asset_entries": [
      { "asset_type": "Motor Vehicle", "amount": 2800.0, "description": "Toyota Yaris, Baujahr 2011, geschätzter Wert ca. 2.800 EUR" }
    ],
    "assets_description": null,

    "bank_name": "Berliner Volksbank",
    "account_holder": "Sabine Reinhardt",
    "iban": "DE29100900004512873600",
    "bic": "BEVODEBB",

    "has_received_previous_benefits": true,
    "previous_benefits_authority": "Bezirksamt Mitte von Berlin, Wohngeldstelle",
    "previous_benefits_period": "01.05.2024 - 31.07.2026",
    "previous_benefits_ref_no": "WG-MI-2024-30918",
    "has_applied_for_asylum_benefits": false,
    "has_applied_for_benefits_awaiting_decision": false,
    "are_one_time_payments_expected": false,
    "gave_away_assets_last_10_years": false,
    "gross_negligence_last_10_years": false,

    "has_disability_id": false,
    "disability_valid_until": null,
    "merkzeichen": null,
    "disability_application_pending": false,
    "is_care_dependent": false,
    "has_costly_medical_nutrition": false,

    "identification_numbers": "T4RQ81ZKC",
    "tax_id": "27 604 913 558",

    "is_subsidized_housing": false,
    "has_other_residence": false,
    "has_secondary_residence": false,
    "has_garage_costs": false,
    "garage_costs": 0.00,
    "has_household_energy_costs": false,
    "household_energy_costs": 0.00,
    "is_living_area_used_commercially": false,
    "commercially_used_area_sqm": null,
    "is_student_or_trainee": false,
    "professional_expenses": 0.00,
    "has_childcare_expenses": false,
    "is_victim_of_national_socialist_persecution": false,
    "is_wohngeld_first_application": true,
    "receives_wohngeld_for_other_dwelling": false,
    "household_member_died_recently": false,
    "household_size_will_change": false,
    "receives_other_transfer_benefits": false,
    "pays_child_or_spousal_support": false,
    "receives_support_from_others": false,
    "expects_future_income_change": false,
    "assets_exceed_wohngeld_threshold": false,
    "related_to_landlord": false,
    "service_costs_included_in_rent": false,
    "rent_paid_partly_by_third_party": false,
    "receives_rent_contribution_from_others": false,
    "expects_rent_change": false,
    "wohngeld_payment_to_applicant": true,
    "consents_to_bank_statement_retention": true,
    "consents_to_registry_verification": true,
    "has_unavoidable_special_need": false,
    "was_self_employed_last_5_years": false,
    "received_wage_replacement_last_5_years": false,
    "did_military_or_voluntary_service_last_5_years": false,
    "cared_for_relatives_last_5_years": false
  },

  "applications": [
    {
      "form_type": "antrag_grundsicherung_im_alter",
      "status": "in_progress",
      "form_data": {}
    },
    {
      "form_type": "antrag_wohngeld",
      "status": "in_progress",
      "form_data": {}
    },
    {
      "form_type": "antrag_bewohnerparkausweis",
      "status": "in_progress",
      "form_data": {}
    }
  ],

  "documents": [
    {
      "document_type": "id_card",
      "status": "verified",
      "display_name": "Personalausweis_Sabine_Reinhardt.pdf",
      "asset": { "generate": true, "title": "Personalausweis", "subtitle": "Bundesrepublik Deutschland" },
      "raw_data": {
        "document_id": "T4RQ81ZKC",
        "gender": "F",
        "given_names": "Sabine",
        "last_name": "Reinhardt",
        "nationality": "DEU",
        "date_of_birth": "1968-04-22",
        "place_of_birth": "Potsdam",
        "valid_until": "2031-08-07",
        "date_of_issue": "2021-08-07",
        "place_of_issue": "Berlin",
        "address": "Invalidenstraße 84, 10115 Berlin",
        "issuing_authority": "Bezirksamt Mitte von Berlin"
      }
    },
    {
      "document_type": "rent",
      "status": "verified",
      "display_name": "Mietvertrag_Sabine_Reinhardt.pdf",
      "asset": { "generate": true, "title": "Mietvertrag", "subtitle": "Wohnungsbaugesellschaft Mitte mbH" },
      "raw_data": {
        "tenant_name": "Sabine Reinhardt",
        "tenant_address": "Invalidenstraße 84, 10115 Berlin",
        "net_cold_rent": 655.00,
        "monthly_total_rent": 780.00,
        "operating_costs": 125.00,
        "heating_costs": 105.00,
        "square_meters": 52.0,
        "is_main_tenant": true,
        "has_sub_tenants": false,
        "start_date_of_rent": "2016-09-01",
        "end_date_of_rent": null
      }
    },
    {
      "document_type": "health_insurance",
      "status": "verified",
      "display_name": "Mitgliedsbescheinigung_BARMER_Sabine_Reinhardt.pdf",
      "asset": { "generate": true, "title": "Mitgliedsbescheinigung", "subtitle": "BARMER" },
      "raw_data": {
        "full_name": "Sabine Reinhardt",
        "insurance_name": "BARMER",
        "pension_insurance_number": "22220468R071",
        "health_insurance_status": "compulsory_insurance"
      }
    },
    {
      "document_type": "stmt3",
      "status": "ready_for_review",
      "display_name": "Kontoauszug_Sabine_Reinhardt.pdf",
      "asset": { "generate": true, "title": "Kontoauszug", "subtitle": "Berliner Volksbank" },
      "user_error_code": "OLD_STATEMENT_WARNING",
      "internal_error_log": "Demo fixture: statement period ends more than three months before the application date.",
      "raw_data": {
        "iban": "DE29100900004512873600",
        "account_holder_name": "Sabine Reinhardt",
        "statement_period_start": "2026-01-01",
        "statement_period_end": "2026-03-31",
        "statement_date": "2026-03-31",
        "account_balance": 31.47,
        "amount_rent": 780.00,
        "amount_pension": 245.00,
        "amount_liability_insurance": 120.00
      }
    }
  ]
}
