{
  "$schema": "../persona.schema.json",
  "slug": "sandor",
  "phone_number": "+493023125103",
  "title": "Sandor — Ausländischer Mann, Langzeitempfänger",
  "source": "demo/research/03_sandor.md",
  "portrait": "portraits/Sandor.png",
  "scenario": "Mid-flow with visible document-quality problems. His Nebenkostenabrechnung failed as illegible, his Kontoauszug is missing pages, and the Heizkostenabrechnung was never uploaded — the KdU documentation trap his User Stories 5, 8 and 9 describe. Use this one for upload feedback, error copy, multilingual surfaces and the housing-cost flow.",

  "profile": {
    "first_name": "Sandor",
    "last_name": "Haddad",
    "email": "sandor.haddad@example.org",
    "date_of_birth": "1965-09-30",
    "place_of_birth": "Aleppo",
    "legal_gender": "Male",
    "marital_status": "Single",
    "married_since": null,
    "is_german_citizen": false,
    "is_resident_in_germany": true,
    "nationality": "SY",
    "second_nationality": null,
    "has_guardian": false,
    "has_custodian": false,
    "displaced_status": null,
    "residence_status": "Asylberechtigt, Aufenthaltserlaubnis nach § 25 Abs. 1 AufenthG",
    "license_plate": "B-SH 309",
    "vehicle_make": "VW Polo",
    "vehicle_year": "2007",

    "street": "Boxhagener Straße",
    "house_number": "112",
    "zip_code": "10245",
    "city": "Berlin",
    "state": "Berlin",
    "district": "Friedrichshain-Kreuzberg",

    "persons_in_household_count": 1,

    "social_security_type": "None",
    "health_insurance_provider": "DAK",
    "health_insurance_status": "Compulsory Insurance",
    "pension_insurance_provider": null,
    "pension_insurance_no": null,

    "is_currently_employed": false,
    "can_work_at_least_3h_daily": true,
    "ability_to_work": "Fully able",
    "has_permanent_reduction_in_earning_capacity": false,
    "has_inpatient_facility_accommodation": false,

    "accomodation_type": "Rental Apartment",
    "tenancy_status": "Main Tenant",
    "rent_total": 620.00,
    "heating_costs": 95.00,
    "hot_water_costs": 18.00,
    "cable_tv_costs": 0.00,
    "number_of_rooms": 1,
    "living_area": 41.00,
    "sublet_room_count": null,
    "sublet_rent_income": null,
    "rent_paid_until": "2026-07-31",
    "landlord_name": "Boxi Immobilien KG",
    "heating_type": "Gasheizung",
    "free_housing_right_holder": null,

    "monthly_income": 290.00,
    "income_entries": [
      { "income_type": "Asylum Seeker Benefits", "monthly_amount": 290.0 }
    ],
    "has_assets": true,
    "asset_entries": [
      { "asset_type": "Motor Vehicle", "amount": 900.0, "description": "VW Polo, Baujahr 2007, geschätzter Wert ca. 900 EUR" }
    ],
    "assets_description": null,

    "bank_name": "N26 Bank",
    "account_holder": "Sandor Haddad",
    "iban": "DE71100110012629748220",
    "bic": "NTSBDEB1",

    "has_received_previous_benefits": true,
    "previous_benefits_authority": "Bezirksamt Friedrichshain-Kreuzberg von Berlin, Wohngeldstelle",
    "previous_benefits_period": "01.02.2022 - 30.06.2026",
    "previous_benefits_ref_no": "WG-NK-2022-11734",
    "has_applied_for_asylum_benefits": true,
    "has_applied_for_benefits_awaiting_decision": false,
    "are_one_time_payments_expected": false,
    "gave_away_assets_last_10_years": false,
    "gross_negligence_last_10_years": false,

    "has_disability_id": false,
    "disability_valid_until": null,
    "merkzeichen": null,
    "disability_application_pending": false,
    "is_care_dependent": false,
    "has_costly_medical_nutrition": false,

    "identification_numbers": "AR8402715",
    "azr_number": "130712648503",
    "tax_id": "51 297 806 344",

    "is_subsidized_housing": false,
    "has_other_residence": false,
    "has_secondary_residence": false,
    "has_garage_costs": false,
    "garage_costs": 0.00,
    "has_household_energy_costs": false,
    "household_energy_costs": 0.00,
    "is_living_area_used_commercially": false,
    "commercially_used_area_sqm": null,
    "is_student_or_trainee": false,
    "professional_expenses": 0.00,
    "has_childcare_expenses": false,
    "is_victim_of_national_socialist_persecution": false,
    "is_wohngeld_first_application": false,
    "receives_wohngeld_for_other_dwelling": false,
    "household_member_died_recently": false,
    "household_size_will_change": false,
    "receives_other_transfer_benefits": false,
    "pays_child_or_spousal_support": false,
    "receives_support_from_others": false,
    "expects_future_income_change": false,
    "assets_exceed_wohngeld_threshold": false,
    "related_to_landlord": false,
    "service_costs_included_in_rent": false,
    "rent_paid_partly_by_third_party": false,
    "receives_rent_contribution_from_others": false,
    "expects_rent_change": false,
    "wohngeld_payment_to_applicant": true,
    "consents_to_bank_statement_retention": true,
    "consents_to_registry_verification": true,
    "has_unavoidable_special_need": false,
    "was_self_employed_last_5_years": false,
    "received_wage_replacement_last_5_years": false,
    "did_military_or_voluntary_service_last_5_years": false,
    "cared_for_relatives_last_5_years": false
  },

  "applications": [
    {
      "form_type": "antrag_grundsicherung_im_alter",
      "status": "in_progress",
      "form_data": {}
    },
    {
      "form_type": "antrag_wohngeld",
      "status": "in_progress",
      "form_data": {}
    },
    {
      "form_type": "antrag_bewohnerparkausweis",
      "status": "in_progress",
      "form_data": {}
    }
  ],

  "documents": [
    {
      "document_type": "id_card",
      "status": "verified",
      "display_name": "Aufenthaltstitel_Sandor_Haddad.pdf",
      "asset": { "generate": true, "title": "Aufenthaltstitel", "subtitle": "§ 25 Abs. 1 AufenthG" },
      "raw_data": {
        "document_id": "AR8402715",
        "gender": "M",
        "given_names": "Sandor",
        "last_name": "Haddad",
        "nationality": "SYR",
        "date_of_birth": "1965-09-30",
        "place_of_birth": "Aleppo",
        "valid_until": "2028-11-05",
        "date_of_issue": "2025-11-05",
        "place_of_issue": "Berlin",
        "address": "Sonnenallee 112, 12045 Berlin",
        "issuing_authority": "Landesamt für Einwanderung Berlin"
      }
    },
    {
      "document_type": "rent",
      "status": "verified",
      "display_name": "Mietvertrag_Sandor_Haddad.pdf",
      "asset": { "generate": true, "title": "Mietvertrag", "subtitle": "Sonnenallee Immobilien KG" },
      "raw_data": {
        "tenant_name": "Sandor Haddad",
        "tenant_address": "Sonnenallee 112, 12045 Berlin",
        "net_cold_rent": 507.00,
        "monthly_total_rent": 620.00,
        "operating_costs": 113.00,
        "heating_costs": 95.00,
        "square_meters": 41.0,
        "is_main_tenant": true,
        "has_sub_tenants": false,
        "start_date_of_rent": "2021-11-01",
        "end_date_of_rent": null
      }
    },
    {
      "document_type": "stmt3",
      "status": "ready_for_review",
      "display_name": "Kontoauszug_Sandor_Haddad.pdf",
      "asset": { "generate": true, "title": "Kontoauszug", "subtitle": "N26 Bank" },
      "user_error_code": "PAGINATION_MISSING_PAGES",
      "internal_error_log": "Demo fixture: page 2 of 3 absent, so the closing balance could not be confirmed.",
      "raw_data": {
        "iban": "DE71100110012629748220",
        "account_holder_name": "Sandor Haddad",
        "statement_period_start": "2026-05-01",
        "statement_period_end": "2026-07-31",
        "statement_date": "2026-07-31",
        "amount_rent": 620.00
      }
    },
    {
      "document_type": "utility_bill",
      "status": "failed",
      "display_name": "Nebenkostenabrechnung_Sandor_Haddad.jpg",
      "asset": { "generate": true, "title": "Nebenkostenabrechnung", "subtitle": "Abrechnungszeitraum 2025" },
      "user_error_code": "LEGIBILITY_ISSUES",
      "internal_error_log": "Demo fixture: photographed at an angle with glare across the totals column; extraction abandoned.",
      "raw_data": {}
    }
  ]
}
