{
  "$schema": "../persona.schema.json",
  "slug": "helmut",
  "phone_number": "+493023125102",
  "title": "Helmut — Verheirateter deutscher Rentner mit niedriger Altersrente",
  "source": "demo/research/02_helmut.md",
  "portrait": "portraits/Helmut.png",
  "scenario": "The only persona built entirely from real committed scans — Personalausweis, Mietvertrag, Rentenbescheid, Kontoauszug, Heizkostenabrechnung, Versicherungsbescheinigung — with every profile figure read directly off them. Use this one when you want a document you can open and trust, not a synthetic stand-in.",
  "profile": {
    "first_name": "Helmut",
    "last_name": "Klar",
    "email": "helmut.klar@example.org",
    "date_of_birth": "1947-02-14",
    "place_of_birth": "Berlin",
    "legal_gender": "Male",
    "marital_status": "Married",
    "married_since": "1974-08-30",
    "is_german_citizen": true,
    "is_resident_in_germany": true,
    "nationality": "DE",
    "second_nationality": null,
    "has_guardian": false,
    "has_custodian": false,
    "displaced_status": null,
    "residence_status": null,
    "license_plate": "B-HK 142",
    "vehicle_make": "Opel Corsa",
    "vehicle_year": "2004",

    "street": "Hauptstraße",
    "house_number": "4",
    "zip_code": "10820",
    "city": "Berlin",
    "state": "Berlin",
    "district": "Tempelhof-Schöneberg",
    "apartment_floor_location": "2. OG",
    "resident_in_berlin_since": "1986-01-01",
    "resident_in_district_since": "1998-04-01",
    "persons_in_household_count": 2,
    "social_security_type": "Pension Insurance",
    "health_insurance_provider": "AOK Nordost",
    "health_insurance_status": "Compulsory Insurance",
    "pension_insurance_provider": "Deutsche Rentenversicherung Bund",
    "pension_insurance_no": "52 171060 S 060",
    "is_currently_employed": false,
    "can_work_at_least_3h_daily": false,
    "reduced_work_capacity_reason": "Rentner",
    "ability_to_work": "Fully able",
    "has_permanent_reduction_in_earning_capacity": false,
    "has_inpatient_facility_accommodation": false,
    "accomodation_type": "Rental Apartment",
    "tenancy_status": "Main Tenant",
    "rent_total": 430.87,
    "heating_costs": 25.0,
    "hot_water_costs": 0.0,
    "cable_tv_costs": 0.0,
    "number_of_rooms": 3,
    "living_area": 68.0,
    "sublet_room_count": null,
    "sublet_rent_income": 0.0,
    "rent_paid_until": "2026-07-31",
    "landlord_name": "Wohngenossenschaft Berlin eG",
    "landlord_address": "Torstraße 12, 10119 Berlin",
    "heating_type": "Sammelheizung",
    "free_housing_right_holder": null,
    "monthly_income": 650.0,
    "income_entries": [
      { "income_type": "Pension", "monthly_amount": 650.0 }
    ],
    "has_assets": true,
    "asset_entries": [
      { "asset_type": "Savings and Cash", "amount": 5267.56 },
      { "asset_type": "Motor Vehicle", "amount": 1200.0, "description": "Opel Corsa, Baujahr 2004, geschätzter Wert ca. 1.200 EUR" }
    ],
    "assets_description": null,
    "bank_name": "Sparkasse Musterstadt",
    "account_holder": "Helmut Klar",
    "iban": "DE65940594210000123456",
    "bic": "SPMSDE66XXX",
    "has_received_previous_benefits": true,
    "previous_benefits_authority": "Bezirksamt Tempelhof-Schöneberg, Amt für Soziales, Tempelhofer Damm 165, 12099 Berlin",
    "previous_benefits_period": "30.06.2026",
    "previous_benefits_ref_no": "GS-TS-2021-4471",
    "has_applied_for_asylum_benefits": false,
    "has_applied_for_benefits_awaiting_decision": false,
    "are_one_time_payments_expected": false,
    "gave_away_assets_last_10_years": false,
    "gross_negligence_last_10_years": false,
    "has_disability_id": false,
    "disability_valid_until": null,
    "merkzeichen": null,
    "disability_application_pending": false,
    "is_care_dependent": false,
    "has_costly_medical_nutrition": false,
    "is_victim_of_national_socialist_persecution": false,
    "identification_numbers": "L7XKP29TM",
    "tax_id": "63 815 402 917",
    "is_subsidized_housing": false,
    "has_other_residence": false,
    "has_secondary_residence": false,
    "has_garage_costs": false,
    "garage_costs": 0.0,
    "has_household_energy_costs": false,
    "household_energy_costs": 0.0,
    "is_living_area_used_commercially": false,
    "commercially_used_area_sqm": null,
    "is_student_or_trainee": false,
    "professional_expenses": 0.0,
    "has_childcare_expenses": false,
    "associated_persons": [
      {
        "association_type": "Spouse",
        "lives_in_household": true,
        "sort_order": 0,
        "first_name": "Ingrid",
        "last_name": "Klar",
        "birth_name": "Neumann",
        "date_of_birth": "1949-11-03",
        "place_of_birth": "Berlin",
        "legal_gender": "Female",
        "marital_status": "Married",
        "nationality": "DE",
        "relationship_to_applicant": "Ehefrau",
        "employment_status": "Rentnerin",
        "monthly_pension_income": 520.0
      }
    ],
    "is_wohngeld_first_application": true,
    "receives_wohngeld_for_other_dwelling": false,
    "household_member_died_recently": false,
    "household_size_will_change": false,
    "receives_other_transfer_benefits": false,
    "pays_child_or_spousal_support": false,
    "receives_support_from_others": false,
    "expects_future_income_change": false,
    "assets_exceed_wohngeld_threshold": false,
    "related_to_landlord": false,
    "service_costs_included_in_rent": false,
    "rent_paid_partly_by_third_party": false,
    "receives_rent_contribution_from_others": false,
    "expects_rent_change": false,
    "wohngeld_payment_to_applicant": true,
    "consents_to_bank_statement_retention": true,
    "consents_to_registry_verification": true,
    "has_unavoidable_special_need": false,
    "was_self_employed_last_5_years": false,
    "received_wage_replacement_last_5_years": false,
    "did_military_or_voluntary_service_last_5_years": false,
    "cared_for_relatives_last_5_years": false
  },
  "applications": [
    {
      "form_type": "antrag_grundsicherung_im_alter",
      "status": "in_progress",
      "form_data": {}
    },
    {
      "form_type": "antrag_wohngeld",
      "status": "in_progress",
      "form_data": {}
    },
    {
      "form_type": "antrag_bewohnerparkausweis",
      "status": "in_progress",
      "form_data": {}
    }
  ],
  "documents": [
    {
      "document_type": "id_card",
      "status": "verified",
      "display_name": "Personalausweis_Helmut_Klar.png",
      "asset": "Personalausweis_ Helmut_Klar.png",
      "raw_data": {
        "document_id": "L7XKP29TM",
        "gender": "M",
        "given_names": "Helmut",
        "last_name": "Klar",
        "nationality": "DEU",
        "date_of_birth": "1947-02-14",
        "place_of_birth": "Berlin",
        "valid_until": "2030-05-19",
        "date_of_issue": "2020-05-19",
        "place_of_issue": "Berlin",
        "address": "Hauptstr. 4, 10820 Berlin",
        "issuing_authority": "Bezirksamt Tempelhof-Schöneberg von Berlin"
      }
    },
    {
      "document_type": "rent",
      "status": "verified",
      "display_name": "Mietvertrag_Helmut_Klar.pdf",
      "asset": "Beispiel Mietvertrag.pdf",
      "raw_data": {
        "tenant_name": "Helmut Klar",
        "tenant_address": "Hauptstr. 4, 10820 Berlin",
        "net_cold_rent": 355.87,
        "monthly_total_rent": 430.87,
        "operating_costs": 75.0,
        "heating_costs": 25.0,
        "square_meters": 68.0,
        "is_main_tenant": true,
        "has_sub_tenants": false,
        "start_date_of_rent": "1998-04-01",
        "end_date_of_rent": null
      }
    },
    {
      "document_type": "pension_notice",
      "status": "verified",
      "display_name": "Rentenbescheid_Helmut_Klar.pdf",
      "asset": "Grundsicherung_Rentenbescheid_Helmut Klar.pdf",
      "raw_data": {
        "pension_reason": "Altersrente",
        "pension_insurance_number": "52 171060 S 060",
        "case_number": "4617 (000-01)",
        "start_date_of_pension": "2026-01-01",
        "end_date_of_pension": null,
        "monthly_amount": 650.0,
        "back_pay_amount": null,
        "date_of_issue": "2026-04-23",
        "is_granted": true
      }
    },
    {
      "document_type": "stmt3",
      "status": "verified",
      "display_name": "Kontoauszug_Helmut_Klar.pdf",
      "asset": "Bank_Statement_Helmut_Klar.pdf",
      "raw_data": {
        "iban": "DE65940594210000123456",
        "account_holder_name": "Helmut Klar",
        "statement_period_start": "2026-01-01",
        "statement_period_end": "2026-03-31",
        "statement_date": "2026-04-04",
        "account_balance": 5267.56,
        "amount_rent": 430.87,
        "amount_pension": 650.0,
        "amount_liability_insurance": 52.67
      }
    },
    {
      "document_type": "heating",
      "status": "verified",
      "display_name": "Heizkostenabrechnung_Helmut_Klar.pdf",
      "asset": "Heizkostenabrechnung Helmut Klar.pdf",
      "raw_data": {
        "annual_total_heating_costs": 321.85,
        "annual_consumption_amount_kwh_per_square_meter": 166.0
      }
    },
    {
      "document_type": "health_insurance",
      "status": "verified",
      "display_name": "Versicherungsbescheinigung_Helmut_Klar.pdf",
      "asset": "Versicherungsbescheinigung_Helmut_Klar.pdf",
      "raw_data": {
        "full_name": "Helmut Klar",
        "insurance_name": "AOK Nordost",
        "pension_insurance_number": "52 171060 S 060",
        "health_insurance_status": "compulsory_insurance"
      }
    }
  ]
}
